{
  "$schema": "https://json-schema.org/draft/2020-12/schema",
  "title": "Sphere Board Starter map — sphere-starter/0.3",
  "description": "Standalone Sphere Board Starter map format. source, when present, marks a read-only projection. Semantic rules are implemented by app/core.js.",
  "type": "object",
  "properties": {
    "profile": {
      "const": "sphere-starter/0.3"
    },
    "meta": {
      "type": "object",
      "properties": {
        "title": {
          "type": "string",
          "minLength": 1,
          "maxLength": 240
        },
        "description": {
          "type": "string",
          "maxLength": 5000
        },
        "isDemo": {
          "type": "boolean"
        },
        "id": {
          "type": "string",
          "minLength": 1,
          "maxLength": 80,
          "pattern": "^[^\\u0000-\\u001f\\u007f-\\u009f]+$",
          "not": {
            "enum": [
              "__proto__",
              "prototype",
              "constructor"
            ]
          }
        }
      },
      "required": [
        "title"
      ],
      "additionalProperties": false
    },
    "revision": {
      "type": "integer",
      "minimum": 0
    },
    "updatedAt": {
      "anyOf": [
        {
          "type": "string",
          "pattern": "^\\d{4}-\\d{2}-\\d{2}T\\d{2}:\\d{2}:\\d{2}(\\.\\d{3})?Z$"
        },
        {
          "type": "null"
        }
      ]
    },
    "updatedBy": {
      "anyOf": [
        {
          "type": "string",
          "minLength": 1,
          "maxLength": 80,
          "pattern": "^[^\\u0000-\\u001f\\u007f-\\u009f]+$",
          "not": {
            "enum": [
              "__proto__",
              "prototype",
              "constructor"
            ]
          }
        },
        {
          "type": "null"
        }
      ]
    },
    "lastChange": {
      "type": "string",
      "maxLength": 3000
    },
    "actors": {
      "type": "array",
      "items": {
        "type": "object",
        "properties": {
          "id": {
            "type": "string",
            "minLength": 1,
            "maxLength": 80,
            "pattern": "^[^\\u0000-\\u001f\\u007f-\\u009f]+$",
            "not": {
              "enum": [
                "__proto__",
                "prototype",
                "constructor"
              ]
            }
          },
          "label": {
            "type": "string",
            "maxLength": 160
          },
          "kind": {
            "enum": [
              "human",
              "ai",
              "system",
              "unknown"
            ]
          }
        },
        "required": [
          "id",
          "label",
          "kind"
        ],
        "additionalProperties": false
      },
      "maxItems": 100
    },
    "currents": {
      "type": "array",
      "items": {
        "type": "string",
        "minLength": 1,
        "maxLength": 80,
        "pattern": "^[^\\u0000-\\u001f\\u007f-\\u009f]+$",
        "not": {
          "enum": [
            "__proto__",
            "prototype",
            "constructor"
          ]
        }
      },
      "uniqueItems": true,
      "maxItems": 500
    },
    "nodes": {
      "type": "array",
      "items": {
        "type": "object",
        "properties": {
          "id": {
            "type": "string",
            "minLength": 1,
            "maxLength": 80,
            "pattern": "^[^\\u0000-\\u001f\\u007f-\\u009f]+$",
            "not": {
              "enum": [
                "__proto__",
                "prototype",
                "constructor"
              ]
            }
          },
          "kind": {
            "enum": [
              "project",
              "phase",
              "group",
              "management",
              "task",
              "gate",
              "issue",
              "decision",
              "actor"
            ]
          },
          "label": {
            "type": "string",
            "minLength": 1,
            "maxLength": 240
          },
          "description": {
            "type": "string",
            "maxLength": 8000
          },
          "x": {
            "type": "number",
            "minimum": -100000,
            "maximum": 100000
          },
          "y": {
            "type": "number",
            "minimum": -100000,
            "maximum": 100000
          },
          "owner": {
            "anyOf": [
              {
                "type": "string",
                "minLength": 1,
                "maxLength": 80,
                "pattern": "^[^\\u0000-\\u001f\\u007f-\\u009f]+$",
                "not": {
                  "enum": [
                    "__proto__",
                    "prototype",
                    "constructor"
                  ]
                }
              },
              {
                "type": "null"
              }
            ]
          },
          "state": {
            "enum": [
              "not_started",
              "in_progress",
              "frozen",
              "carried_over",
              "spanning",
              "returned",
              "handed_over",
              "record_only",
              "off_mainline",
              "cancelled",
              "discarded",
              "out_of_scope",
              "scheduled",
              "none",
              "unknown",
              "pending",
              "passed",
              "passed_with_defects",
              "sent_back"
            ]
          },
          "ready": {
            "type": [
              "boolean",
              "null"
            ]
          },
          "readyReason": {
            "type": "string",
            "maxLength": 2000
          },
          "acceptance": {
            "type": "array",
            "items": {
              "type": "string",
              "maxLength": 1500
            },
            "maxItems": 20
          },
          "evidence": {
            "type": "array",
            "items": {
              "type": "object",
              "properties": {
                "kind": {
                  "enum": [
                    "user",
                    "artifact",
                    "test",
                    "review"
                  ]
                },
                "reference": {
                  "type": "string",
                  "maxLength": 2000
                },
                "summary": {
                  "type": "string",
                  "maxLength": 2000
                }
              },
              "required": [
                "kind",
                "reference",
                "summary"
              ],
              "additionalProperties": false
            },
            "maxItems": 30
          },
          "requiresHumanApproval": {
            "type": "boolean"
          },
          "approval": {
            "type": "object",
            "properties": {
              "actorId": {
                "type": "string",
                "minLength": 1,
                "maxLength": 80,
                "pattern": "^[^\\u0000-\\u001f\\u007f-\\u009f]+$",
                "not": {
                  "enum": [
                    "__proto__",
                    "prototype",
                    "constructor"
                  ]
                }
              },
              "evidence": {
                "type": "string",
                "maxLength": 2000
              },
              "recordedAt": {
                "type": "string",
                "pattern": "^\\d{4}-\\d{2}-\\d{2}T\\d{2}:\\d{2}:\\d{2}(\\.\\d{3})?Z$"
              }
            },
            "required": [
              "actorId",
              "evidence",
              "recordedAt"
            ],
            "additionalProperties": false
          },
          "lane": {
            "type": "string",
            "maxLength": 160
          },
          "derived": {
            "type": "boolean"
          },
          "planned": {
            "type": "boolean"
          },
          "source": {
            "type": "object",
            "additionalProperties": true,
            "description": "Opaque original fields, displayed only as data."
          },
          "reason": {
            "type": "string",
            "maxLength": 3000,
            "description": "Reason for cancellation; record intermediate outputs in description/evidence."
          },
          "order": {
            "type": "integer",
            "description": "Explicit order values sort first numerically; absent orders follow in nodes[] order. Ties use nodes[] index, kind, id."
          },
          "gateKind": {
            "enum": [
              "explicit",
              "recheck",
              "event"
            ]
          }
        },
        "required": [
          "id",
          "kind",
          "label",
          "owner",
          "state",
          "ready"
        ],
        "additionalProperties": false,
        "allOf": [
          {
            "if": {
              "required": [
                "gateKind"
              ]
            },
            "then": {
              "properties": {
                "kind": {
                  "const": "gate"
                }
              }
            }
          }
        ]
      },
      "maxItems": 500
    },
    "edges": {
      "type": "array",
      "items": {
        "type": "object",
        "properties": {
          "id": {
            "type": "string",
            "minLength": 1,
            "maxLength": 80,
            "pattern": "^[^\\u0000-\\u001f\\u007f-\\u009f]+$",
            "not": {
              "enum": [
                "__proto__",
                "prototype",
                "constructor"
              ]
            }
          },
          "from": {
            "type": "string",
            "minLength": 1,
            "maxLength": 80,
            "pattern": "^[^\\u0000-\\u001f\\u007f-\\u009f]+$",
            "not": {
              "enum": [
                "__proto__",
                "prototype",
                "constructor"
              ]
            }
          },
          "to": {
            "type": "string",
            "minLength": 1,
            "maxLength": 80,
            "pattern": "^[^\\u0000-\\u001f\\u007f-\\u009f]+$",
            "not": {
              "enum": [
                "__proto__",
                "prototype",
                "constructor"
              ]
            }
          },
          "kind": {
            "enum": [
              "parent",
              "dependency",
              "origin",
              "return",
              "blocks"
            ]
          },
          "active": {
            "type": "boolean"
          },
          "certainty": {
            "enum": [
              "explicit",
              "proposed"
            ]
          },
          "note": {
            "type": "string",
            "maxLength": 2000
          }
        },
        "required": [
          "id",
          "from",
          "to",
          "kind",
          "active",
          "certainty"
        ],
        "additionalProperties": false
      },
      "maxItems": 1500
    },
    "regions": {
      "type": "array",
      "items": {
        "type": "object",
        "properties": {
          "id": {
            "type": "string",
            "minLength": 1,
            "maxLength": 80,
            "pattern": "^[^\\u0000-\\u001f\\u007f-\\u009f]+$",
            "not": {
              "enum": [
                "__proto__",
                "prototype",
                "constructor"
              ]
            }
          },
          "kind": {
            "const": "planned"
          },
          "label": {
            "type": "string",
            "maxLength": 240
          },
          "x": {
            "type": "number",
            "minimum": -100000,
            "maximum": 100000
          },
          "y": {
            "type": "number",
            "minimum": -100000,
            "maximum": 100000
          },
          "width": {
            "type": "number",
            "exclusiveMinimum": 0,
            "maximum": 200000
          },
          "height": {
            "type": "number",
            "exclusiveMinimum": 0,
            "maximum": 200000
          }
        },
        "required": [
          "id",
          "kind",
          "label",
          "x",
          "y",
          "width",
          "height"
        ],
        "additionalProperties": false
      },
      "maxItems": 100
    },
    "extensions": {
      "type": "object",
      "propertyNames": {
        "pattern": "^[a-z][a-z0-9-]*:[A-Za-z0-9._-]+$"
      },
      "additionalProperties": true
    },
    "lanes": {
      "type": "array",
      "maxItems": 100,
      "uniqueItems": true,
      "items": {
        "type": "string",
        "maxLength": 160
      }
    },
    "problems": {
      "type": "array",
      "maxItems": 10000,
      "items": {
        "type": "string",
        "maxLength": 12000
      }
    },
    "source": {
      "type": "object",
      "description": "Opaque provenance; its presence makes the entire map read-only. The renderer never interprets these fields.",
      "additionalProperties": true
    },
    "layout": {
      "type": "object",
      "properties": {
        "mode": {
          "enum": [
            "auto",
            "manual"
          ]
        }
      },
      "additionalProperties": false
    }
  },
  "required": [
    "profile",
    "meta",
    "revision",
    "updatedAt",
    "updatedBy",
    "actors",
    "currents",
    "nodes",
    "edges",
    "regions",
    "lastChange",
    "lanes",
    "problems"
  ],
  "additionalProperties": false,
  "$id": "urn:sphere:starter-map:0.3"
}
