{
  "profile": "sphere-starter/0.3",
  "meta": {
    "title": "Turn ideas into a map for moving work forward.",
    "description": "Sphere Board starter · fictional display and workflow fixture. This does not represent real progress.",
    "isDemo": true
  },
  "revision": 0,
  "updatedAt": null,
  "updatedBy": null,
  "actors": [
    {
      "id": "human",
      "label": "Maintainer (fictional)",
      "kind": "human"
    },
    {
      "id": "planner",
      "label": "Planner AI (fictional)",
      "kind": "ai"
    },
    {
      "id": "builder",
      "label": "Builder AI (fictional)",
      "kind": "ai"
    }
  ],
  "currents": [
    "renderer",
    "theme",
    "workflow"
  ],
  "nodes": [
    {
      "id": "purpose",
      "kind": "task",
      "label": "Define the purpose",
      "description": "This map contains fictional data for display and update tests. It is not a completion report for a real project.",
      "x": 125,
      "y": 220,
      "owner": "human",
      "state": "returned",
      "ready": false,
      "acceptance": [],
      "evidence": [
        {
          "kind": "user",
          "reference": "fixture:demo-only",
          "summary": "This fictional example assumes results were returned to the mainline. It is not evidence of real work."
        }
      ],
      "lane": "Decisions (fictional)",
      "derived": false,
      "planned": false
    },
    {
      "id": "input",
      "kind": "task",
      "label": "Structure the plan",
      "description": "Turn a WBS or written outline into one portable map.json.",
      "x": 355,
      "y": 160,
      "owner": "planner",
      "state": "returned",
      "ready": false,
      "acceptance": [],
      "evidence": [
        {
          "kind": "user",
          "reference": "fixture:demo-only",
          "summary": "Acceptance criterion for a fictional example. Not evidence of real work."
        }
      ],
      "lane": "Design (fictional)",
      "derived": false,
      "planned": false
    },
    {
      "id": "contract",
      "kind": "gate",
      "label": "Fix the semantic structure",
      "description": "Fix the meaning of IDs, relations, and current positions. The approval record is a fictional fixture.",
      "x": 565,
      "y": 220,
      "owner": "human",
      "state": "passed",
      "ready": false,
      "acceptance": [],
      "evidence": [
        {
          "kind": "user",
          "reference": "fixture:demo-only",
          "summary": "Acceptance criterion for a fictional example. Not evidence of real work."
        }
      ],
      "approval": {
        "actorId": "human",
        "evidence": "fixture:synthetic-human-approval",
        "recordedAt": "2026-10-05T00:00:00Z"
      },
      "lane": "Decisions (fictional)",
      "derived": false,
      "planned": false
    },
    {
      "id": "renderer",
      "kind": "task",
      "label": "Render Sphere Board",
      "description": "The same meaning at the same coordinates. Change only the appearance.",
      "x": 795,
      "y": 220,
      "owner": "builder",
      "state": "in_progress",
      "ready": true,
      "acceptance": [
        "Display all relations",
        "Each node can be selected with the keyboard"
      ],
      "evidence": [],
      "readyReason": "Fictional demo condition: prerequisites have been checked and starting this work is authorized.",
      "lane": "Implementation (fictional)",
      "derived": false,
      "planned": false
    },
    {
      "id": "quality",
      "kind": "gate",
      "label": "Verify display and updates",
      "description": "Record passing tests and human approval separately.",
      "x": 1030,
      "y": 220,
      "owner": "human",
      "state": "pending",
      "ready": false,
      "acceptance": [],
      "evidence": [],
      "lane": "Decisions (fictional)",
      "derived": false,
      "planned": false
    },
    {
      "id": "release",
      "kind": "task",
      "label": "Finish the local distribution",
      "description": "Fictional plan for local review with the license undecided. No publication.",
      "x": 1250,
      "y": 220,
      "owner": "human",
      "state": "not_started",
      "ready": false,
      "acceptance": [],
      "evidence": [],
      "lane": "Decisions (fictional)",
      "derived": false,
      "planned": false
    },
    {
      "id": "actor-view",
      "kind": "actor",
      "label": "Collaborators",
      "description": "People and AI refer to the same ledger.",
      "x": 125,
      "y": 490,
      "owner": "human",
      "state": "unknown",
      "ready": null,
      "acceptance": [],
      "evidence": [],
      "lane": "Decisions (fictional)",
      "derived": false,
      "planned": false
    },
    {
      "id": "prompt",
      "kind": "task",
      "label": "Map creation prompt",
      "description": "Do not invent owners, deadlines, or approvals absent from the input.",
      "x": 355,
      "y": 475,
      "owner": "planner",
      "state": "not_started",
      "ready": true,
      "acceptance": [],
      "evidence": [],
      "readyReason": "Fictional demo condition: prerequisites have been checked and starting this work is authorized.",
      "lane": "Design (fictional)",
      "derived": true,
      "planned": false
    },
    {
      "id": "theme",
      "kind": "task",
      "label": "Design the skin",
      "description": "Work is in progress, with an unresolved issue about custom-rendering boundaries. Current position and readiness are independent.",
      "x": 565,
      "y": 475,
      "owner": "planner",
      "state": "in_progress",
      "ready": false,
      "acceptance": [],
      "evidence": [],
      "lane": "Design (fictional)",
      "derived": true,
      "planned": false
    },
    {
      "id": "workflow",
      "kind": "task",
      "label": "AI update rules",
      "description": "Implement evidence-based updates, multiple current positions, and conflict detection.",
      "x": 795,
      "y": 475,
      "owner": "builder",
      "state": "in_progress",
      "ready": true,
      "acceptance": [],
      "evidence": [],
      "readyReason": "Fictional demo condition: prerequisites have been checked and starting this work is authorized.",
      "lane": "Implementation (fictional)",
      "derived": true,
      "planned": false
    },
    {
      "id": "security",
      "kind": "issue",
      "label": "Allow arbitrary code?",
      "description": "Fictional issue exploring a policy against arbitrary code in themes. It blocks theme; this is not a return relation.",
      "x": 1030,
      "y": 475,
      "owner": "builder",
      "state": "in_progress",
      "ready": false,
      "acceptance": [],
      "evidence": [],
      "lane": "Implementation (fictional)",
      "derived": false,
      "planned": false
    },
    {
      "id": "scope",
      "kind": "decision",
      "label": "Define the scope of use",
      "description": "AI must not mark a decision as made without approval.",
      "x": 1250,
      "y": 475,
      "owner": "human",
      "state": "not_started",
      "ready": null,
      "acceptance": [],
      "evidence": [],
      "lane": "Decisions (fictional)",
      "derived": false,
      "planned": false
    }
  ],
  "edges": [
    {
      "id": "e01",
      "from": "purpose",
      "to": "input",
      "kind": "dependency",
      "active": true,
      "certainty": "explicit",
      "note": ""
    },
    {
      "id": "e02",
      "from": "input",
      "to": "contract",
      "kind": "dependency",
      "active": true,
      "certainty": "explicit",
      "note": ""
    },
    {
      "id": "e03",
      "from": "contract",
      "to": "renderer",
      "kind": "dependency",
      "active": true,
      "certainty": "explicit",
      "note": ""
    },
    {
      "id": "e04",
      "from": "renderer",
      "to": "quality",
      "kind": "dependency",
      "active": true,
      "certainty": "explicit",
      "note": ""
    },
    {
      "id": "e05",
      "from": "quality",
      "to": "release",
      "kind": "dependency",
      "active": true,
      "certainty": "explicit",
      "note": ""
    },
    {
      "id": "e06",
      "from": "actor-view",
      "to": "purpose",
      "kind": "origin",
      "active": true,
      "certainty": "explicit",
      "note": ""
    },
    {
      "id": "e07",
      "from": "input",
      "to": "prompt",
      "kind": "parent",
      "active": true,
      "certainty": "explicit",
      "note": ""
    },
    {
      "id": "e08",
      "from": "contract",
      "to": "theme",
      "kind": "parent",
      "active": true,
      "certainty": "explicit",
      "note": ""
    },
    {
      "id": "e09",
      "from": "renderer",
      "to": "workflow",
      "kind": "parent",
      "active": true,
      "certainty": "explicit",
      "note": ""
    },
    {
      "id": "e10",
      "from": "security",
      "to": "theme",
      "kind": "blocks",
      "active": true,
      "certainty": "explicit",
      "note": ""
    },
    {
      "id": "e11",
      "from": "workflow",
      "to": "renderer",
      "kind": "return",
      "active": true,
      "certainty": "explicit",
      "note": "Fictional: the destination for returning derived workflow-design results to mainline implementation. This is not a gate sending work back."
    },
    {
      "id": "e12",
      "from": "scope",
      "to": "release",
      "kind": "dependency",
      "active": true,
      "certainty": "explicit",
      "note": ""
    }
  ],
  "regions": [
    {
      "id": "future",
      "kind": "planned",
      "label": "NEXT HORIZON / Next planning area",
      "x": 925,
      "y": 95,
      "width": 430,
      "height": 505
    }
  ],
  "lastChange": "",
  "lanes": [
    "Design (fictional)",
    "Implementation (fictional)",
    "Decisions (fictional)"
  ],
  "problems": []
}
